MessageId,PostUserId,Message,PostDate
1,1,Hello everyone!,2021-01-05
2,2,Hi there I'm new here.,2021-02-18
3,1,Welcome to the forum!,2021-01-06
4,3,Any recommendations for books?,2021-03-22
5,2,Sure! What genre are you interested in?,2021-02-20
6,4,Hey fellow dreamers!,2021-04-15
7,5,Planning a hiking trip soon.. any tips?,2021-05-10
8,6,Feeling artistic today! here's my latest work.,2021-06-25
9,7,Discussing future plans and dreams.,2021-07-08
10,8,Organizing a coding meetup!! anyone interested?,2021-08-01
11,9,Exploring new cooking recipes.,2021-09-18
12,10,Music festival vibes! Who's joining?,2021-10-10
13,11,Debating the latest scientific theories.,2021-11-27
14,12,Sharing thoughts on leadership and management.,2021-12-22
15,13,Creating a cozy reading nook at home.,2022-01-10
16,14,Volunteering at a local charity event.,2022-02-28
17,15,Analyzing data for a research project.,2022-03-15
18,16,Planning an adventurous road trip.,2022-04-05
19,17,Book recommendations for self-improvement?,2022-05-20
20,18,Leading a community cleanup initiative.,2022-06-15
21,19,Exploring mindfulness and meditation.,2021-01-15
22,20,Discussing the latest movies and TV shows.,2021-02-28
23,21,Sharing insights from a recent travel adventure.,2021-03-10
24,22,Reflecting on personal growth and self-discovery.,2021-04-02
25,5,Exploring new ways to stay active and healthy.,2021-05-25
26,6,Sharing experiences from a recent volunteer trip.,2021-06-18
27,7,Discussing career aspirations and goals.,2021-07-30
28,8,Exploring the world of technology and gadgets.,2021-08-25
29,9,Hi! are you really manic?,2021-09-12
30,10,Discussing creative writing and storytelling.,2023-10-28
31,11,Sharing thoughts on environmental conservation.,2023-11-15
32,12,Exploring the realm of philosophy and ethics.,2021-12-10
33,13,Discussing the power of positive thinking.,2022-01-25
34,14,Reflecting on the impact of art and culture.,2022-02-15
35,15,Exploring the world of fashion and style.,2022-03-05
36,16,Discussing the role of technology in education.,2020-04-20
37,17,Sharing insights from a recent entrepreneurship seminar.,2022-05-10
38,18, I got excited when I thought we would be discussing world domination strategiest.,2022-06-05



